{
  "profile": "malt.artifact/v0alpha2",
  "trusted_root": "bafkreihdwdcefgh4dqkjv67uzcmw7ojee6xedzdetojuzjevtenxquvyku",
  "expected": {
    "operation": "resolve",
    "query": {"kind": "path", "segments": []}
  },
  "artifact": {
    "profile": "malt.artifact/v0alpha2",
    "operation": "resolve",
    "root": "bafkreihdwdcefgh4dqkjv67uzcmw7ojee6xedzdetojuzjevtenxquvyku",
    "query": {"kind": "path", "segments": []},
    "target": "bafkreihdwdcefgh4dqkjv67uzcmw7ojee6xedzdetojuzjevtenxquvyku",
    "prooflist": {
      "root": {"/": "bafkreihdwdcefgh4dqkjv67uzcmw7ojee6xedzdetojuzjevtenxquvyku"},
      "steps": []
    }
  }
}
